{
  "schema": "agents-source-distribution/v1",
  "id": "agents.source-distribution",
  "version": 1,
  "generated": false,
  "authority": "AGENTS.md#0.14",
  "scope": "src",
  "profiles": [
    "consumer-core",
    "consumer-runtime",
    "consumer-scenario",
    "consumer-bootstrap",
    "generated-release"
  ],
  "entries": [
    {
      "path": ".ia.rules/core/runtime/scripts/legacy-update-bridge.ts",
      "profile": "consumer-bootstrap",
      "destination": "scripts/.agents/autoupdate.ts",
      "purpose": "bridge transitório para atualizadores anteriores ao handoff",
      "roles": [
        "final"
      ],
      "condition": "legacy-update-bridge",
      "ownership": "managed",
      "validation": [
        "source-exists",
        "destination-unique",
        "integrity-at-build",
        "legacy-bootstrap-functional"
      ],
      "language": "typescript",
      "artifact": {
        "destination": "scripts/.agents/autoupdate.js",
        "format": "commonjs",
        "target": "node24",
        "builder": "typescript@7.0.2+esbuild@0.28.1",
        "bundle": true
      }
    },
    {
      "path": ".ia.rules/core/runtime/scripts/legacy-update-entry.ts",
      "profile": "consumer-bootstrap",
      "destination": "scripts/.agents/update-agents.ts",
      "purpose": "compatibilidade com dispatchers históricos que carregam diretamente update-agents.js",
      "roles": [
        "final"
      ],
      "condition": "legacy-update-bridge",
      "ownership": "managed",
      "validation": [
        "source-exists",
        "destination-unique",
        "integrity-at-build",
        "legacy-bootstrap-functional"
      ],
      "language": "typescript",
      "artifact": {
        "destination": "scripts/.agents/update-agents.js",
        "format": "commonjs",
        "target": "node24",
        "builder": "typescript@7.0.2+esbuild@0.28.1",
        "bundle": true
      }
    },
    {
      "path": "legacy-update-bridge/.agents/core/contracts.md",
      "profile": "consumer-bootstrap",
      "destination": "scripts/.agents/bootstrap/core/contracts.md",
      "purpose": "marcador exigido por coletores históricos",
      "roles": [
        "final"
      ],
      "condition": "legacy-update-bridge",
      "ownership": "managed",
      "validation": [
        "source-exists",
        "destination-unique",
        "integrity-at-build"
      ]
    },
    {
      "path": "legacy-update-bridge/.agents/core/concepts/microconceitos.md",
      "profile": "consumer-bootstrap",
      "destination": "scripts/.agents/bootstrap/core/concepts/microconceitos.md",
      "purpose": "marcador exigido por coletores históricos",
      "roles": [
        "final"
      ],
      "condition": "legacy-update-bridge",
      "ownership": "managed",
      "validation": [
        "source-exists",
        "destination-unique",
        "integrity-at-build"
      ]
    },
    {
      "path": "legacy-update-bridge/.agents/core/update/scenario.md",
      "profile": "consumer-bootstrap",
      "destination": "scripts/.agents/bootstrap/core/update/scenario.md",
      "purpose": "marcador exigido por coletores históricos",
      "roles": [
        "final"
      ],
      "condition": "legacy-update-bridge",
      "ownership": "managed",
      "validation": [
        "source-exists",
        "destination-unique",
        "integrity-at-build"
      ]
    },
    {
      "path": "legacy-update-bridge/.agents/scenarios/web/page-like/scenario.md",
      "profile": "consumer-bootstrap",
      "destination": "scripts/.agents/bootstrap/scenarios/web/page-like/scenario.md",
      "purpose": "marcador exigido por coletores históricos",
      "roles": [
        "final"
      ],
      "condition": "legacy-update-bridge",
      "ownership": "managed",
      "validation": [
        "source-exists",
        "destination-unique",
        "integrity-at-build"
      ]
    },
    {
      "path": "legacy-update-bridge/scripts/.agents/package.json",
      "profile": "consumer-bootstrap",
      "destination": "scripts/.agents/package.json",
      "purpose": "sentinela para coletores físicos anteriores ao manifesto",
      "roles": [
        "final"
      ],
      "condition": "legacy-update-bridge",
      "ownership": "managed",
      "validation": [
        "source-exists",
        "destination-unique",
        "integrity-at-build"
      ]
    },
    {
      "path": ".ia.rules/config/core.json",
      "profile": "consumer-core",
      "destination": ".ia.rules/config/core.json",
      "purpose": "norma, contrato ou manifesto comum",
      "roles": [
        "final",
        "constructor"
      ],
      "condition": "always",
      "ownership": "managed",
      "validation": [
        "source-exists",
        "destination-unique",
        "integrity-at-build"
      ]
    },
    {
      "path": ".ia.rules/config/repository.json",
      "profile": "consumer-core",
      "destination": ".ia.rules/config/repository.json",
      "purpose": "metadados autenticados de repositório, autoria, licença e caminhos",
      "roles": [
        "final",
        "constructor"
      ],
      "condition": "always",
      "ownership": "managed",
      "validation": [
        "source-exists",
        "destination-unique",
        "integrity-at-build"
      ]
    },
    {
      "path": ".ia.rules/config/schema.json",
      "profile": "consumer-core",
      "destination": ".ia.rules/config/schema.json",
      "purpose": "norma, contrato ou manifesto comum",
      "roles": [
        "final",
        "constructor"
      ],
      "condition": "always",
      "ownership": "managed",
      "validation": [
        "source-exists",
        "destination-unique",
        "integrity-at-build"
      ]
    },
    {
      "path": ".ia.rules/core/authority.md",
      "profile": "consumer-core",
      "destination": ".ia.rules/core/authority.md",
      "purpose": "norma, contrato ou manifesto comum",
      "roles": [
        "final",
        "constructor"
      ],
      "condition": "always",
      "ownership": "managed",
      "validation": [
        "source-exists",
        "destination-unique",
        "integrity-at-build"
      ]
    },
    {
      "path": ".ia.rules/core/concepts/microconceitos.md",
      "profile": "consumer-core",
      "destination": ".ia.rules/core/concepts/microconceitos.md",
      "purpose": "norma, contrato ou manifesto comum",
      "roles": [
        "final",
        "constructor"
      ],
      "condition": "always",
      "ownership": "managed",
      "validation": [
        "source-exists",
        "destination-unique",
        "integrity-at-build"
      ]
    },
    {
      "path": ".ia.rules/core/contracts.md",
      "profile": "consumer-core",
      "destination": ".ia.rules/core/contracts.md",
      "purpose": "norma, contrato ou manifesto comum",
      "roles": [
        "final",
        "constructor"
      ],
      "condition": "always",
      "ownership": "managed",
      "validation": [
        "source-exists",
        "destination-unique",
        "integrity-at-build"
      ]
    },
    {
      "path": ".ia.rules/core/formats/normative-index.v1.schema.json",
      "profile": "consumer-core",
      "destination": ".ia.rules/core/formats/normative-index.v1.schema.json",
      "purpose": "norma, contrato ou manifesto comum",
      "roles": [
        "final",
        "constructor"
      ],
      "condition": "always",
      "ownership": "managed",
      "validation": [
        "source-exists",
        "destination-unique",
        "integrity-at-build"
      ]
    },
    {
      "path": ".ia.rules/core/formats/rcf-trace-map.v1.schema.json",
      "profile": "consumer-core",
      "destination": ".ia.rules/core/formats/rcf-trace-map.v1.schema.json",
      "purpose": "schema público do mapa sentença e commit",
      "roles": [
        "final",
        "constructor"
      ],
      "condition": "always",
      "ownership": "managed",
      "validation": [
        "source-exists",
        "destination-unique",
        "integrity-at-build"
      ]
    },
    {
      "path": ".ia.rules/core/formats/skill-descriptor.v1.schema.json",
      "profile": "consumer-core",
      "destination": ".ia.rules/core/formats/skill-descriptor.v1.schema.json",
      "purpose": "schema público do descritor extraído de Skill",
      "roles": [
        "final",
        "constructor"
      ],
      "condition": "skill-contract-or-validation",
      "ownership": "managed",
      "validation": [
        "source-exists",
        "destination-unique",
        "integrity-at-build",
        "json-schema-draft-2020-12"
      ]
    },
    {
      "path": ".ia.rules/core/formats/source-distribution-manifest.v1.schema.json",
      "profile": "consumer-core",
      "destination": ".ia.rules/core/formats/source-distribution-manifest.v1.schema.json",
      "purpose": "norma, contrato ou manifesto comum",
      "roles": [
        "final",
        "constructor"
      ],
      "condition": "always",
      "ownership": "managed",
      "validation": [
        "source-exists",
        "destination-unique",
        "integrity-at-build"
      ]
    },
    {
      "path": ".ia.rules/core/formats/subagent-descriptor.v1.schema.json",
      "profile": "consumer-core",
      "destination": ".ia.rules/core/formats/subagent-descriptor.v1.schema.json",
      "purpose": "schema público do descritor de Subagent",
      "roles": [
        "final",
        "constructor"
      ],
      "condition": "subagent-contract-or-validation",
      "ownership": "managed",
      "validation": [
        "source-exists",
        "destination-unique",
        "integrity-at-build",
        "json-schema-draft-2020-12"
      ]
    },
    {
      "path": ".ia.rules/core/routing.md",
      "profile": "consumer-core",
      "destination": ".ia.rules/core/routing.md",
      "purpose": "norma, contrato ou manifesto comum",
      "roles": [
        "final",
        "constructor"
      ],
      "condition": "always",
      "ownership": "managed",